{
  "$schema": "https://json-schema.org/draft/2020-12/schema",
  "$id": "https://github.com/danielfrey63/orggraph/schema/snapshot.schema.json",
  "title": "OrgGraph graph snapshot",
  "description": "Raw, unversioned full-state snapshot within a declared scope (PRD §3, §5.1, E20). Produced by harvesters and the one-time legacy migration; validated by the app importer (PRD FR-6.8). Snapshots never carry validity fields — validity intervals are internal store representation created by the import (PRD FR-3.6).",
  "type": "object",
  "required": ["meta", "schema", "nodes", "edges"],
  "additionalProperties": false,
  "properties": {
    "meta": {
      "type": "object",
      "required": ["source", "crawledAt", "snapshot", "registryVersion", "scope"],
      "additionalProperties": true,
      "properties": {
        "source": { "type": "string", "description": "Source URL or system (PRD FR-3.1)." },
        "crawledAt": { "type": "string", "description": "ISO timestamp of the crawl/migration run." },
        "snapshot": {
          "type": "string",
          "pattern": "^[0-9]{8}-[0-9]{4}$",
          "description": "Snapshot stamp YYYYMMDD-HHMM (PRD FR-3.1); imports must be chronological (PRD FR-6.9)."
        },
        "registryVersion": {
          "type": "string",
          "description": "Version of the registry the run was crawled against (PRD FR-6.1b)."
        },
        "scope": { "$ref": "#/$defs/scope" }
      }
    },
    "schema": {
      "type": "object",
      "required": ["nodeTypes", "edgeTypes"],
      "additionalProperties": false,
      "description": "Subset of the registry: only the types actually used, with full registry declarations (PRD FR-3.4). Structural conformance is validated here; that the entries actually match the curated registry is checked by the importer (PRD FR-6.8).",
      "properties": {
        "nodeTypes": {
          "type": "object",
          "additionalProperties": { "$ref": "registry.schema.json#/$defs/nodeType" }
        },
        "edgeTypes": {
          "type": "object",
          "additionalProperties": { "$ref": "registry.schema.json#/$defs/edgeType" }
        }
      }
    },
    "nodes": { "type": "array", "items": { "$ref": "#/$defs/node" } },
    "edges": { "type": "array", "items": { "$ref": "#/$defs/edge" } }
  },
  "$defs": {
    "scope": {
      "type": "object",
      "required": ["nodeTypes", "edgeTypes"],
      "additionalProperties": false,
      "description": "Declares what this snapshot is a full state for; membership is evaluated on the pre-import stock (PRD FR-5.5, FR-5.5a).",
      "properties": {
        "nodeTypes": { "type": "array", "items": { "type": "string" } },
        "edgeTypes": { "type": "array", "items": { "type": "string" } },
        "roots": {
          "type": "array",
          "items": { "type": "string" },
          "description": "Optional subtree restriction (node ids)."
        },
        "excluded": {
          "type": "array",
          "items": { "type": "string" },
          "description": "Node ids acting as excluded subtree roots, e.g. failed fetches (PRD FR-5.7)."
        },
        "edgeSources": {
          "type": "array",
          "items": { "type": "string" },
          "description": "Visited source node ids of an enrichment crawl: the snapshot is a full state of their outgoing edges of the declared edgeTypes, without their node type being subject to closure (PRD FR-5.5, E30)."
        },
        "traversalEdgeTypes": {
          "type": "array",
          "items": { "type": "string" },
          "description": "Edge types used ONLY to determine roots reachability (boundary traversal); they never become closure candidates. Defaults to edgeTypes when absent (PRD FR-5.5, E34)."
        }
      }
    },
    "node": {
      "type": "object",
      "required": ["id", "type", "label"],
      "additionalProperties": false,
      "properties": {
        "id": { "type": "string" },
        "type": { "type": "string" },
        "label": { "type": "string", "description": "Canonical, versioned default display name (PRD FR-3.2, FR-4.2b)." },
        "props": { "$ref": "#/$defs/props" }
      }
    },
    "edge": {
      "type": "object",
      "required": ["type", "source", "target"],
      "additionalProperties": false,
      "properties": {
        "type": { "type": "string" },
        "source": { "type": "string", "description": "Node id (PRD FR-3.3)." },
        "target": { "type": "string", "description": "Node id (PRD FR-3.3)." },
        "props": { "$ref": "#/$defs/props" }
      }
    },
    "props": {
      "type": "object",
      "description": "Scalar values only (PRD FR-4.5): string, number, boolean, or null; reference props carry a node id as string. Arrays and nested objects are not allowed in v1 — multi-valued information is reified as nodes/edges.",
      "additionalProperties": { "type": ["string", "number", "boolean", "null"] }
    }
  }
}
